title,category,city,address,contact,description,image
"Lenceria Cheung La Cova ropa interior mayorista","生意","Valencia","Av. Mas de l'Oli 88, 46940 Manises, Valencia","Tel: 961 544 668","平台代登记商家信息，商家待认领。Public directory Cylex lists Lenceria Cheung at Av. Mas de l Oli 88, Manises, as lenceria / ropa interior wholesale. Cheung surname suggests Chinese/Asian merchant; admin should verify with owner before promotion.","https://images.unsplash.com/photo-1515886657613-9f3515b0c78f?auto=format&fit=crop&w=900&q=82"
"Quiu Shi Bolsos S.L. La Cova bolsos mayorista","生意","Valencia","Partida La Cova 26, 46940 Manises, Valencia","Tel: 961 523 229","平台代登记商家信息，商家待认领。Public directory Cylex lists Quiu Shi Bolsos S.L. in Partida La Cova 26, Manises, under handbags and leather goods wholesale. Qiu/Quiu name clue suggests Chinese merchant; admin should verify.","https://images.unsplash.com/photo-1523381294911-8d3cead13475?auto=format&fit=crop&w=900&q=82"
"LA LUNA Manises accesorios y bisuteria mayorista","生意","Valencia","Avenida de la Cova 178, 46940 Manises, Valencia","Tel: 961 536 021","平台代登记商家信息，商家待认领。Public directory Cylex lists LA LUNA Manises at Avenida de la Cova 178, with hair accessories, textile accessories and jewellery wholesale. Asian/Chinese ownership not fully confirmed, keep as pending verification.","https://images.unsplash.com/photo-1512909006721-3d6018887383?auto=format&fit=crop&w=900&q=82"
"La Riqueza S.L. La Cova multiprecio bazar mayorista","生意","Valencia","C/ Mas de l'Oli 150, 46940 Manises, Valencia","Tel: 961 544 088","平台代登记商家信息，商家待认领。Public directory Cylex lists La Riqueza S.L. at Mas de l Oli 150, Manises, under gift items, multiprecio, hogar y jardin, bazares and wholesale. Asian/Chinese ownership not fully confirmed, keep as pending verification.","https://images.unsplash.com/photo-1604719312566-8912e9227c6a?auto=format&fit=crop&w=900&q=82"
"Ilovemom La Cova moda infantil mayorista","生意","Valencia","Avda. de la Cova 35, 46940 Manises, Valencia","Tel: 961 538 674","平台代登记商家信息，商家待认领。Public directory Cylex lists Ilovemom at Avda. de la Cova 35, Manises, as a wholesaler. Name and category suggest children/family retail or wholesale; Chinese/Asian ownership not fully confirmed, keep as pending verification.","https://images.unsplash.com/photo-1515488042361-ee00e0ddd4e4?auto=format&fit=crop&w=900&q=82"